title;category;published_date;author;article_url;image_url;content;source_page
Pimpinan Komisi I DPR Ingatkan Hal Ini terkait Video Prabowo di Bioskop;;Senin, 15 Sep 2025 07:19 WIB;Matius Alfons Hutajulu - detikNews;https://news.detik.com/berita/d-8112072/pimpinan-komisi-i-dpr-ingatkan-hal-ini-terkait-video-prabowo-di-bioskop;https://akcdn.detik.net.id/community/media/visual/2025/03/19/wakil-ketua-komisi-i-dpr-ri-dave-laksono-1742364893167_43.jpeg?w=210&q=90;"Wakil Ketua Komisi I DPR Dave Laksono memberi tanggapan soal video Presiden Prabowo Subianto dengan capaian-capaiannya tayang di bioskop sebelum film dimulai. Dave menghargai sorotan publik atas video tersebut. ""Saya menghargai perhatian publik terhadap dinamika komunikasi pemerintah, termasuk soal penayangan video sosialisasi di ruang-ruang komersial seperti bioskop,"" kata Dave saat dihubungi, Senin (15/9/2025).  SCROLL TO CONTINUE WITH CONTENT Dave menilai wajar ketika masyarakat beragam merespons langkah pemerintah dalam mensosialisasikan capaian Presiden Prabowo. Menurutnya, kritik berarti membuka ruang adanya evaluasi dari cara pemerintah berkomunikasi. ""Kami di Komisi I DPR RI juga mencermati bahwa ruang publik, termasuk media sosial, menunjukkan beragam respons. Ini adalah hal yang wajar dalam iklim demokrasi. Kritik dan apresiasi adalah bagian dari ekspresi warga negara yang harus dihormati. Justru dari situ kita bisa menilai efektivitas komunikasi pemerintah-apakah pesan yang disampaikan diterima dengan baik, atau justru menimbulkan pertanyaan dan resistensi,"" ucapnya. Ia pun mendorong agar sosialisasi yang dilakukan pemerintah jangan sampai menimbulkan kesan politisasi di ruang publik. Jangan sampai, lanjut dia, pesan yang disampaikan pemerintah justru kontraproduktif. ""Komisi I DPR RI mendorong agar setiap bentuk sosialisasi dilakukan dengan pendekatan yang inklusif, tidak menimbulkan kesan politisasi ruang publik, dan tetap menjaga sensitivitas sosial. Pemerintah perlu memastikan bahwa pesan yang disampaikan tidak hanya informatif, tetapi juga kontekstual dan tidak menimbulkan persepsi yang kontraproduktif,"" ujar dia. ""Kami juga mengingatkan bahwa ruang publik, baik fisik maupun digital, adalah milik bersama. Maka, kehati-hatian dalam memilih medium, waktu, dan narasi menjadi sangat penting agar komunikasi pemerintah tidak menimbulkan polarisasi, melainkan memperkuat kepercayaan publik terhadap institusi negara,"" lanjut dia.  Terlepas dari itu, Dave tetap menghargai usaha pemerintah yang mencoba bersikap transparan. Ia berpandangan pemerintah juga punya hak untuk memberikan informasi yang benar ke masyarakat. ""Pada prinsipnya, setiap bentuk komunikasi publik yang dilakukan oleh pemerintah harus berpijak pada asas transparansi, proporsionalitas, dan kepatuhan terhadap norma hukum serta etika komunikasi. Bila penayangan tersebut dimaksudkan untuk menyampaikan capaian pemerintahan secara informatif dan tidak melanggar ketentuan hukum yang berlaku, maka hal itu merupakan bagian dari hak pemerintah untuk menyampaikan informasi kepada masyarakat,"" tutur dia.  Seperti diketahui, video capaian Prabowo tayang di bioskop tengah ramai dibahas publik. Dilihat detikcom, Minggu (14/9), video itu menampilkan berbagai cuplikan kegiatan dan potongan pernyataan Prabowo. Video tersebut memuat narasi dan angka dari berbagai pencapaian program, seperti 21.760.000 ton total produksi beras nasional hingga Agustus 2025 dan 5.800 Satuan Pelayanan Pemenuhan Gizi (SPPG) yang telah beroperasi. Kemudian, dinarasikan sebanyak 80 ribu kelembagaan Koperasi Desa Merah Putih resmi diluncurkan. Selain itu, ada narasi 100 Sekolah Rakyat telah diluncurkan. Menteri Sekretaris Negara (Mensesneg) sekaligus jubir Istana, Prasetyo Hadi, juga sempat buka suara. Ia mengatakan penyampaian pesan di ruang-ruang publik merupakan hal lumrah. ""Tentunya sepanjang tidak melanggar aturan, tidak mengganggu kenyamanan keindahan, maka penggunaan media-media publik untuk menyampaikan sebuah pesan tentu sebuah hal yang lumrah,"" kata Prasetyo kepada wartawan, Minggu (14/9).  [Gambas:Video 20detik]  ";8
Truk Tabrak Separator Busway di Slipi, Lalin Arah Tomang Padat;;Senin, 15 Sep 2025 07:17 WIB;Lisye Sri Rahayu - detikNews;https://news.detik.com/berita/d-8112071/truk-tabrak-separator-busway-di-slipi-lalin-arah-tomang-padat;https://akcdn.detik.net.id/community/media/visual/2025/09/15/truk-tabrak-separator-busway-di-slipi-1757895337440_43.jpeg?w=210&q=90;"Satu unit truk menabrak separator busway atau jalur TransJakarta di Slipi, Palmerah, Jakarta Barat. Lalu lintas ke arah Tomang padat imbas kecelakaan ini. Kecelakaan ini diinformasikan oleh TMC Polda Metro Jaya di akun X-nya, Senin (15/9/2025). Titik kecelakaan terjadi di depan Plaza Slipi Jaya. ""06.43 Situasi lalu lintas di depan Plaza Slipi Jaya Jakarta Barat arah Tomang terpantau padat imbas adanya kendaraan truk yang mengalami kecelakaan menabrak separator busway,"" demikian cuit TMC Polda Metro Jaya. SCROLL TO CONTINUE WITH CONTENT  Dari foto yang diunggah TMC Polda Metro, pembatas busway berserakan di lokasi usai ditabrak truk. Kendaraan yang melintas juga terganggu akibat kecelakaan ini. ""Saat ini sedang proses penanganan evakuasi dan penderekan oleh Petugas,"" tuturnya.  Lihat juga Video: Penampakan Mobil Nyangkut di Separator Margonda Seusai Tabrak 5 Kendaraan  [Gambas:Video 20detik]  ";8
Video PM Qatar soal Serangan Israel: Kami Akan Hadapi Setiap Ancaman;;11,962 Views  |  Senin, 15 Sep 2025 05:46 WIB;;https://20.detik.com/detikupdate/20250915-250915009/video-pm-qatar-soal-serangan-israel-kami-akan-hadapi-setiap-ancaman;https://akcdn.detik.net.id/community/media/visual/2025/09/12/qatar-akankah-serangan-israel-luapkan-perang-di-timur-tengah-1757670330532_43.jpeg?w=210&q=90;Qatar merespons tegas serangan udara Israel ke ibukota Doha beberapa waktu lalu. Perdana Menteri Qatar, Sheikh Mohammad bin Abdulrahman al-Thani menyebut pihaknya akan menghadapi setiap ancaman terhadap negaranya. Serangan ke Doha tersebut juga dinilai sebagai Israel yang tak ada niat untuk menyelesaikan masalah dengan Palestina lewat jalur damai. Klik di sini untuk melihat video lainnya!;8
'Deadline' Galian Biang Kerok Macet TB Simatupang;;Senin, 15 Sep 2025 06:59 WIB;Dwi Rahmawati, Devi Puspitasari - detikNews;https://news.detik.com/berita/d-8112060/deadline-galian-biang-kerok-macet-tb-simatupang;https://akcdn.detik.net.id/community/media/visual/2025/08/27/potret-kemacetan-jalan-tb-simatupang-jaksel-pulang-kerja-makin-sengsara-1756297991750_43.jpeg?w=210&q=90;"Jalan TB Simatupang, Jakarta Selatan (Jaksel) masih terkena kemacetan imbas proyek galian. Gubernur Jakarta Pramono Anung memberi deadline untuk menyelesaikan proyek galian tersebut. Mulanya, Pramono menjelaskan, pihaknya akan mengalihkan arus lalu lintas di dalam ataupun luar Tol Jakarta Outer Ring Road (JORR) untuk mengatasi macet di TB Simatupang. Hal itu, menurut dia, sudah mendapat persetujuan dari Kementerian Pekerjaan Umum (PU). ""Jadi untuk TB Simatupang, alhamdulillah kami sudah mendapatkan persetujuan, izin dari Kementerian PU untuk melakukan, mengalihkan arus termasuk nanti pengaturan di dalam jalan tol,"" ujar Pramono di Lubang Buaya, Jakarta Timur, Minggu (14/9/2025). SCROLL TO CONTINUE WITH CONTENT    ""Nanti secara teknisnya asisten pembangunan yang akan menyampaikan. Tetapi prinsipnya adalah sudah mendapatkan izin untuk pengaturan di dalam dan di luar jalan tol,"" imbuhnya.  Pramono mengatakan pihaknya juga sudah menggelar rapat dengan PAM, Bina Marga terkait penyelesaian proyek galian. Dia meminta agar proyek galian selesai akhir Oktober tahun ini. ""Saya juga sudah merapatkan secara khusus, baik itu PAM Jaya Paljaya, kemudian sumber daya air, Bina Marga, semuanya saya minta paling lama akhir Oktober sudah selesai semua,"" tuturnya.    Pramono menyebutkan, bila proyek tersebut rampung, persoalan macet di TB Simatupang akan selesai.  ""Sehingga dengan demikian, kalau ini sudah selesai, maka ini akan bisa menyelesaikan persoalan kemacetan yang betul-betul terjadi di Simatupang,"" tuturnya. Selain itu, Pemprov DKI Jakarta akan melakukan uji coba penggunaan satu lajur paling kiri di Gerbang Tol Fatmawati 2 secara gratis untuk mengurai kemacetan di Jalan TB Simatupang hingga sekitar Stasiun MRT Fatmawati. Uji coba gratis masuk tol ini hanya diperuntukkan bagi kendaraan roda empat. ""Masyarakat dari Jalan Fatmawati yang akan menuju Lebak Bulus, selain menggunakan jalan eksisting, dapat juga menggunakan tambahan satu lajur paling kiri dari gerbang tol Fatmawati 2 dan tanpa dipungut biaya,"" kata Kepala Dinas Perhubungan (Dishub) DKI Jakarta, Syafrin Liputo, dalam keterangan tertulis, Minggu (14/9/2025). Syafrin mengatakan Pemprov DKI telah berkoordinasi dengan Kementerian Pekerjaan Umum RI terkait kebijakan itu. Penggunaan satu lajur di Tol Fatmawati 2 diharapkan mampu mengurai kepadatan ke arah Lebak Bulus. ""Pengelola jalan tol bersedia membuka satu lajur di gerbang tol tersebut untuk kanalisasi lalu lintas dari arah Fatmawati menuju off ramp Lebak Bulus,"" katanya. Lebih lanjut, Syafrin menegaskan kebijakan ini tak berlaku untuk kendaraan roda dua atau kendaraan lebih dari roda empat. Uji coba akan dilaksanakan pada Senin-Jumat, 15-19 September 2025, pukul 17.00-20.00 WIB. ""Merujuk pada data Dishub DKI Jakarta terkait volume kendaraan yang tinggi pada jam sibuk (peak hours) tersebut,"" imbuhnya.  Adapun rekayasa lalu lintas dilakukan pada 15-19 September 2025. Uji coba akan berlangsung pada pukul 17.00 sampai 20.00 WIB. Uji coba rekayasa lalu lintas di Jl TB Simatupang-Jl RA Kartini segmen Simpang Susun Antasari-Simpang Lebak Bulus: a. Untuk menambah kapasitas jalan di Jl. RA Kartini sisi selatan (menuju Lebak Bulus) akan dilakukan penggunaan 1 lajur paling kiri di gerbang tol Fatmawati 2 yang tidak dipungut biaya dengan diberikan kanalisasi sampai off ramp tol Lebak Bulus khusus kendaraan roda empat, untuk kendaraan roda dua atau kendaraan roda lebih dari empat tidak diperkenankan (gambar 2). b. Akan dilakukan penutupan akses dari lajur kiri ke lajur kanan sebelum Poins Square, lalu lintas yang semula menggunakan akses tersebut untuk melakukan putar balik Timur-Timur di u-turn Lebak Bulus dialihkan menggunakan u-turn Ciputat Raya di depan Fedex (gambar 3). c. Akan dilakukan penutupan putaran balik Barat-Barat sebelum simpang Fatmawati, arus lalu lintas dialihkan melalui putaran balik Barat-Barat di simpang susun Antasari (gambar 4). Alternatif urai kepadatan lalu lintas di Jalan TB Simatupang-Jalan RA Kartini: 1. Arus lalu lintas dari arah off ramp Lebak Bulus yang akan menuju arah Timur (Fatmawati) dapat melalui ruas Jalan RA Kartini-berputar arah Timur-Timur di u-turn Lebak Bulus-Jalan RA Kartini dst. 2. Arus lalu lintas dari arah Timur (Pondok Labu/ Cipete/Fatmawati) yang akan berputar arah Timur-Timur masih dapat menggunakan u-turn Lebak Bulus. 3. Arus lalu lintas dari arah JI. Adiaksa yang akan arah Timur (Fatmawati) dapat melalui ruas Jalan RA Kartini-Simpang Lebak Bulus-Jalan RA. Kartini-berputar arah Timur-Timur di u-turn Ciputat Raya (di depan Fedex)-Jalan RA Kartini dst. 4. Arus lalu lintas dari arah Barat (Lebak Bulus/Pondok Indah) yang akan berputar arah Barat-Barat dapat menggunakan u-turn Antasari. 5. Rute alternatif bagi arus lalu lintas dari arah Utara (Jl. Pangeran Antasari) dan arah Timur (Cilandak/Kampung Rambutan) yang akan menuju Pondok Labu dapat melalui Jalan Tol Desari-Off Ramp Andara-Jalan Andara Raya-Berputar arah Utara-Utara di Simpang Jalan Sungai-Jalan Andara Raya-Jalan Margasatwa-Jalan Pondok Labu Raya-dst.  Saksikan Live DetikSore :";8
Komisi IV DPR Tetap Panggil KKP Meski Sudah Ada Solusi Tanggul Cilincing;;Senin, 15 Sep 2025 06:46 WIB;Matius Alfons Hutajulu - detikNews;https://news.detik.com/berita/d-8112055/komisi-iv-dpr-tetap-panggil-kkp-meski-sudah-ada-solusi-tanggul-cilincing;https://akcdn.detik.net.id/community/media/visual/2025/03/07/wakil-ketua-komisi-iv-dpr-alex-indra-lukman-dok-istimewaalex-indra-1741317786581_43.jpeg?w=210&q=90;"Komisi IV DPR akan tetap memanggil Kementerian Kelautan dan Perikanan (KKP) berkaitan dengan polemik tanggul Cilincing. Komisi IV DPR tetap meminta penjelasan KKP meskipun sudah ada solusi yang didapatkan ketika bertemu Pemprov DKI Jakarta hingga perusahaan yang mengerjakan proyek tanggul tersebut. ""Ya alhamdulilah sudah ada solusi buat nelayan, saya pribadi berpendapat persoalan ini sudah selesai,"" kata Ketua Komisi IV DPR Alex Indra Lukman saat dihubungi, Senin (15/9/2025).  SCROLL TO CONTINUE WITH CONTENT Meski begitu, ia menegaskan tetap akan memanggil KKP hari ini. Ia juga mempersilakan jika nantinya para anggota Komisi IV DPR mempertanyakan KKP terkait polemik tanggul di Cilincing tersebut. ""Agenda komisi tetap ada rapat dengan KKP perihal RAPBN 2026, forum tersebut bisa dimanfaatkan oleh KKP bila ada pendalaman perihal tersebut oleh anggota Komisi IV DPR, kami akan tunggu penjelasan yang utuh dari KKP,"" ucap dia.  Senada dengan Alex, Wakil Ketua Komisi IV DPR Abdul Kharis juga tetap akan mendalami persoalan tanggul Cilincing kepada KKP. Ia akan menanyakan lebih jauh terkait CSR atau Corporate Social Responsibility yang diberikan perusahaan kepada masyarakat atau nelayan yang terdampak. ""Besok sore kami ada rapat dengan KKP, membahas RAPBN 2026, kami akan tanyakan ke KKP tentang hal ini (CSR). Besok saja biar saya dengar langsung dari KKP,"" ujar dia. Sebelumnya, Gubernur Jakarta Pramono Anung mengatakan Pemprov Jakarta telah memanggil perusahaan yang membangun tanggul di kawasan pesisir Cilincing, Jakarta Utara. Dia mengatakan, dalam rapat tersebut, disepakati tanggul tak akan mengganggu aktivitas nelayan. ""Kemarin sudah ada pertemuan antara pemerintah DKI Jakarta, perusahaan yang mendapatkan izin untuk membangun tanggul laut itu, dan juga Kementerian KKP. Disepakati bahwa aktivitas nelayan diberikan keleluasaan untuk tetap bisa dilakukan,"" ujar Pramono di Lubang Buaya, Jakarta Timur, Minggu (14/9).  Pramono mengatakan perusahaan terkait juga akan memberi corporate social responsibility (CSR) untuk nelayan. ""Perusahaan diminta untuk memberikan CSR kepada para nelayan yang ada di tempat itu,"" tambahnya.  Simak juga Video: KKP Sebut Tanggul Beton di Cilincing Jakut Legal, Miliki Izin PKKPRL  [Gambas:Video 20detik]  ";9
Wakil PM Spanyol: Israel Harusnya Tak Dapat Berkompetisi di Ajang Apapun;;Senin, 15 Sep 2025 06:39 WIB;Isal Mawardi - detikNews;https://news.detik.com/internasional/d-8112053/wakil-pm-spanyol-israel-harusnya-tak-dapat-berkompetisi-di-ajang-apapun;https://akcdn.detik.net.id/community/media/visual/2025/09/04/la-vuelta-a-espana-2025-1756965938655_43.jpeg?w=210&q=90;"Masyarakat Spanyol menggelar aksi penolakan terhadap keikutsertaan tim Israel, Israel-Premier Tech di kompetisi balapan sepeda La Vuelta a Espana 2025. Wakil PM Spanyol Yolanda Diaz mengatakan Israel harusnya ""tidak dapat berkompetisi dalam ajang apa pun jika terus melakukan genosida"". ""Masyarakat Spanyol telah memberi pelajaran kepada dunia dengan melumpuhkan Vuelta,"" kata Diaz melalui Instagramnya dilansir dari AFP, Senin (15/9/2025). Diketahui, etape terakhir balapan sepeda La Vuelta a Espana 2025 di Madrid dibatalkan karena adanya aksi pro-Palestina. Ribuan pengunjuk rasa berkumpul di Madrid. Mereka menyerbu jalur balapan. SCROLL TO CONTINUE WITH CONTENT Meski begitu, Jonas Vingegaard dinobatkan sebagai juara untuk pertama kalinya.  Sebelumnya, Perdana Menteri Spanyol Pedro Sanchez meluapkan kebanggaannya terhadap aksi penolakan terhadap tim Israel yang dilakukan masyarakatnya. Ia menyebut aksi tersebut sebagai bentuk solidaritas untuk Palestina. ""Pengakuan dan rasa hormat penuhnya kepada para atlet, tetapi juga kekaguman kami kepada orang-orang seperti Spanyol yang bergerak untuk tujuan yang adil, seperti Palestina,"" kata Pedro Sanchez dilansir AFP.  ""Spanyol hari ini bersinar sebagai contoh dan sumber kebanggaan, sebuah contoh bagi komunitas internasional di mana Spanyol melihat langkah maju dalam membela hak asasi manusia,"" lanjutnya. Diketahui, La Vuelta a Espana 2025 merupakan balap sepeda internasional yang digelar selama tiga pekan di Italia, Prancis, Andorra, dan Spanyol. Race dimulai di Turin pada 23 Agustus dan dijadwalkan finis di Madrid pada 14 September. Etape ke-11 balap sepeda La Vuelta a Espana di wilayah Bilbao, Spanyol, pada Rabu (3/9/2025) tak bisa diselesaikan sepenuhnya. Pasalnya, puluhan massa pendukung Palestina berdemonstrasi di dekat garis finis. Para demonstran membawa bendera Palestina di sepanjang jalan dan berusaha mendorong pagar pembatas jalan. Balapan etape ke-11 pun berakhir tanpa pemenang.  [Gambas:Video 20detik]  ";9
Aliran Duit ke Kopda FH di Kasus Penculikan Kacab Bank;;Senin, 15 Sep 2025 06:31 WIB;Azhar Bagas Ramadhan, Devi Puspitasari - detikNews;https://news.detik.com/berita/d-8112050/aliran-duit-ke-kopda-fh-di-kasus-penculikan-kacab-bank;https://akcdn.detik.net.id/community/media/visual/2024/05/30/ilustrasi-kejahatan_43.jpeg?w=210&q=90;"Kasus penculikan dan pembunuhan seorang kepala cabang salah satu bank di Jakarta, Ilham Pradipta (37), memasuki babak baru. Kasus ini diduga melibatkan anggota TNI, Kopda FH. Ilham diduga diculik dan dibunuh pada 20 Agustus lalu. Mayatnya ditemukan di Bekasi, Jawa Barat, sehari setelahnya. Polda Metro Jaya kemudian melakukan penyelidikan terkait kasus ini. Ada 15 orang tersangka yang telah ditangkap. Mereka diduga punya peran berbeda. SCROLL TO CONTINUE WITH CONTENT Salah satu tersangka, RS, diduga berperan menyediakan tim pemantau yang mengikuti Ilham dan menyedikan tim IT. Berikutnya, ada juga Dwi Hartono yang diduga punya peran aktor intelektual serta tim penculik. Ada juga tersangka Ken, YJ, AA, Eras, AT, dan RAH. Mereka diduga punya peran dalam penculikan Ilham. Salah satu tersangka, Eras, mengaku dirinya disuruh oleh seorang berinisial F. Hal itu disampaikan Eras lewat pengacaranya, Adrianus Agau.  Menurut Adrianus, kliennya dihubungi oleh F pada 18 Agustus dan bertemu pada 19 Agustus. Dia mengatakan F saat itu menawarkan pekerjaan untuk menculik Ilham. Singkat cerita, Eras setuju dan penculikan dilakukan pada 20 Agustus atas arahan F. Dia mengatakan Eras dkk juga telah menyerahkan Ilham ke 'Tangan Kanan Bos'. Dia menyebut Ilham diserahkan dalam keadaan hidup. Dia mengatakan F memberikan uang Rp 45 juta sebagai upah penculikan kepada Eras dkk.   Terbaru, TNI membenarkan F yang disebut-sebut Eras merupakan anggota TNI. F diperiksa polisi militer dan akan ditindak tegas jika bersalah. ""TNI berkomitmen, siapa pun prajurit yang memenuhi unsur-unsur pelanggaran hukum, terbukti melakukan pelanggaran atau tindak pidana akan diproses secara tegas sesuai aturan hukum yang berlaku,"" kata Kepala Pusat Penerangan Brigjen TNI Freddy Ardianzah saat dihubungi, Kamis (11/9/2025). Freddy menambahkan TNI serius menindak dugaan pelanggaran yang dilakukan prajurit. Dia menegaskan institusi akan menindak mereka yang melanggar aturan. Dugaan keterlibatan oknum TNI dalam pembunuhan Ilham Pradipta juga dibenarkan Danpomdam Jaya Kolonel CPM Donny Agus. Saat ini prajurit F masih dalam pemeriksaan di Pomdam Jaya. Pada Jumat (12/9), Kolonel Donny menyampaikan bahwa F telah ditetapkan sebagai tersangka. F langsung ditahan. ""Terduga pelaku dengan inisial Kopda FH, terhadap yang bersangkutan sudah dilakukan penahanan dan ditetapkan sebagai tersangka,"" ujar Danpomdam Jaya, Kolonel Cpm Donny Agus Priyanto.   Donny mengatakan F dicari satuan karena absen tanpa izin dinas saat peristiwa dugaan penculikan terjadi. Dia mengatakan F diduga berperan sebagai perantara untuk mencari dan menjemput paksa korban. ""Saat kejadian tersebut statusnya sedang dicari oleh satuan karena tidak hadir tanpa izin dinas. Peran yang bersangkutan sebagai 'perantara' untuk mencari orang guna menjemput paksa,"" jelasnya. TNI juga menjelaskan sejumlah hal yang diketahui dari pemeriksaan FH. Salah satunya, FH diduga menerima sejumlah uang dalam kasus ini. ""Peran Kopda FH dalam kasus ini adalah sebagai perantara, yakni mencari orang untuk melakukan upaya penjemputan paksa. Dari hasil pemeriksaan sementara, motifnya karena yang bersangkutan menerima sejumlah uang,"" ujar Kapuspen TNI Brigjen Freddy Ardianzah kepada wartawan, Minggu (14/9/2025). Namun, Freddy belum menjelaskan detail berapa uang yang diterima FH. Dia juga belum menjelaskan siapa yang memberikan uang itu. ""Pada saat kejadian tindak pidana berlangsung, status yang bersangkutan memang sedang dalam pencarian oleh satuan karena tidak hadir tanpa izin (THTI). Untuk update pemeriksaan nanti akan terus disampaikan oleh Danpomdam Jaya,"" ujarnya.  [Gambas:Video 20detik]  ";9
Legislator soal Video Prabowo di Bioskop: Rakyat  Bisa Menilai Program;;Senin, 15 Sep 2025 06:15 WIB;Matius Alfons Hutajulu - detikNews;https://news.detik.com/berita/d-8112047/legislator-soal-video-prabowo-di-bioskop-rakyat-bisa-menilai-program;https://akcdn.detik.net.id/community/media/visual/2025/01/21/anggota-komisi-i-dpr-ri-oleh-soleh-4_43.jpeg?w=210&q=90;"Anggota Komisi I DPR RI Fraksi PKB Oleh Soleh mendukung upaya pemerintah menayangkan capaian Presiden Prabowo Subianto di bioskop sebelum film dimulai. Oleh menilai cara pemerintah ini bisa memberi pemahaman terhadap masyarakat luas. ""Pada dasarnya saya secara pribadi ya mendukung penuh terhadap penyampaian informasi, baik itu capaian yang dilakukan pemerintah, perencanaan, serta tentu kendala-kendala yang ada, nah informasi ini sangat penting supaya masyarakat luas itu mengetahui karena pada dasarnya ketika hal baik tidak diinformasikan secara masif, maka rakyat tidak akan tahu apa kinerja Pemerintah,"" kata Oleh saat dihubungi, Senin (15/9/2025).  SCROLL TO CONTINUE WITH CONTENT Oleh menilai masyarakat yang tidak tahu fakta maka akan mudah terkontaminasi oleh hoaks atau disinformasi. Menurutnya, itu lebih berbahaya daripada upaya pemerintah bersikap transparan. ""Yang akibatkan dia akan terkontaminasi oleh informasi-informasi yang dibuat hoaks atau yang orang-orang atau kelompok-kelompok tidak suka terhadap pemerintahan. Ketika informasi yang baik tidak tersampaikan, informasi hoaks terus-menerus banjiri medsos, ini juga berbahaya,"" ucap dia.  Selain itu, Oleh mengatakan cara pemerintah ini sebagai bentuk tanggung jawab atas program-program yang dikerjakan selama ini. Ia menilai masyarakat pun juga tahu uangnya dipakai untuk apa oleh pemerintah. ""Karena itu rasa rasanya menjadi tanggung jawab bersama untuk sampaikan apa yang terjadi sebenarnya, lebih-lebih ini soal program pemerintah, program pemerintah kan sumbernya dari uang rakyat, dari pajak, dari SDA, dll, sehingga dengan info yang disampaikan Pak Presiden maka rakyat jadi tahu uang rakyat dipakai apa, untuk siapa, di mana, dan apa manfaatnya,"" jelasnya. ""Sehingga edukasi ini mudah-mudahan jadi suplemen untuk merekatkan, daripada persatuan dan kesatuan sekaligus mendukung dari program-program yang baik. Di situ juga mungkin menjadi sebuah ruang untuk gimana rakyat bisa menilai, amati, apakah program-program pak presiden sudah tepat atau belum,"" lanjutnya.  Seperti diketahui, video capaian Prabowo tayang di bioskop tengah ramai dibahas publik. Dilihat detikcom, Minggu (14/9), video itu menampilkan berbagai cuplikan kegiatan dan potongan pernyataan Prabowo. Video tersebut memuat narasi dan angka dari berbagai pencapaian program, seperti 21.760.000 ton total produksi beras nasional hingga Agustus 2025 dan 5.800 Satuan Pelayanan Pemenuhan Gizi (SPPG) yang telah beroperasi. Kemudian, dinarasikan sebanyak 80 ribu kelembagaan Koperasi Desa Merah Putih resmi diluncurkan. Selain itu, ada narasi 100 Sekolah Rakyat telah diluncurkan. Menteri Sekretaris Negara (Mensesneg) sekaligus jubir Istana, Prasetyo Hadi, juga sempat buka suara. Ia mengatakan penyampaian pesan di ruang-ruang publik merupakan hal lumrah. ""Tentunya sepanjang tidak melanggar aturan, tidak mengganggu kenyamanan keindahan, maka penggunaan media-media publik untuk menyampaikan sebuah pesan tentu sebuah hal yang lumrah,"" kata Prasetyo kepada wartawan, Minggu (14/9).  Simak juga Video Prabowo Ditayangkan di Bioskop, Ini Kata Istana  [Gambas:Video 20detik]  ";9
