title;category;published_date;author;article_url;image_url;content;source_page
Apa Itu Pelican Cross dan Bedanya dengan Zebra Cross?;;Senin, 15 Sep 2025 13:40 WIB;Widhia Arum Wibawana - detikNews;https://news.detik.com/berita/d-8112766/apa-itu-pelican-cross-dan-bedanya-dengan-zebra-cross;https://akcdn.detik.net.id/community/media/visual/2025/09/15/warga-menyeberang-di-pelican-crossing-di-stasiun-cikini-jakarta-pusat-1757909629814_43.jpeg?w=210&q=90;"Ada beragam bentuk jalur penyeberangan pejalan kaki, salah satunya adalah pelican crossing. Fasilitas tersebut saat ini juga tengah melakukan uji coba penerapannya oleh Pemerintah Provinsi (Pemprov) DKI Jakarta di kawasan Stasiun Cikini. Langkah ini dilakukan setelah adanya keluhan warga mengenai pagar akses masuk stasiun yang kerap dilompati penumpang. Pemprov DKI bersama PT KAI akhirnya membuka akses sisi timur stasiun dan memasang pelican crossing sebagai jalur penyeberangan resmi. ""Hal ini dilakukan untuk memudahkan mobilitas para pengguna commuter line saat menyeberang dan memasuki area stasiun secara lebih aman,"" ujar Kepala Biro Pembangunan dan Lingkungan Hidup Setda Provinsi DKI Jakarta, Iwan Kurniawan, dikutip dari situs resmi Pemprov DKI, Minggu (14/9/2025). SCROLL TO CONTINUE WITH CONTENT Uji coba pelican crossing ini disesuaikan dengan jam operasional commuter line, yaitu pukul 05.00-24.00 WIB. Iwan juga mengimbau pengendara yang melintas di sekitar stasiun agar mematuhi rambu lalu lintas dan mendahulukan keselamatan pejalan kaki. Masyarakat pun diajak menggunakan fasilitas penyeberangan ini secara tertib. Pelican crossing adalah jalur penyeberangan jalan yang dilengkapi lampu lalu lintas khusus untuk pejalan kaki. Nama ""pelican"" sendiri berasal dari singkatan ""PEdestrian LIght CONtrolled"". Fasilitas ini pertama kali diterapkan di Inggris pada 1969 dan kini digunakan di berbagai negara, dikutip dari Financial Times. Mekanismenya sederhana: pejalan kaki cukup menekan tombol pada tiang sinyal, kemudian lampu kendaraan akan berubah menjadi merah untuk memberi waktu aman menyeberang. Dengan adanya lampu khusus ini, arus kendaraan dan pejalan kaki dapat diatur lebih tertib serta mengurangi potensi kecelakaan. Meski sama-sama menjadi jalur penyeberangan, pelican crossing berbeda dengan zebra cross. Menurut Save Driving for Life, zebra cross hanya berupa marka garis putih di jalan tanpa kontrol lampu lalu lintas, sehingga keberhasilannya sangat bergantung pada kesadaran pengendara untuk berhenti. Pelican crossing dilengkapi tombol dan lampu sinyal yang akan menyala setelah ditekan oleh pejalan kaki. Saat lampu hijau pejalan menyala, kendaraan wajib berhenti hingga waktu yang ditentukan. Durasi menyeberang bervariasi, mulai dari 7 hingga 40 detik, tergantung kondisi jalan dan volume penyeberang. Fasilitas ini umumnya dipasang di lokasi dengan arus lalu lintas padat atau jumlah penyeberang tinggi. Namun, efektivitasnya tetap dipengaruhi kedisiplinan pengguna jalan. Tidak jarang masih ada pengendara yang menerobos meski lampu sudah merah, sehingga kesadaran bersama tetap menjadi faktor penting. Uji coba pelican crossing di Stasiun Cikini diharapkan memberi alternatif penyeberangan yang lebih aman dan tertib. Berbeda dengan zebra cross, fasilitas ini dilengkapi lampu lalu lintas yang memberi kepastian waktu bagi pejalan kaki untuk menyeberang.  Saksikan Live DetikSore :";3
Tipu-tipu Modus Cari Musuh, Maling di Jakpus Coba Bawa Kabur Motor Pelajar;;Senin, 15 Sep 2025 13:35 WIB;Wildan Noviansah - detikNews;https://news.detik.com/berita/d-8112764/tipu-tipu-modus-cari-musuh-maling-di-jakpus-coba-bawa-kabur-motor-pelajar;https://akcdn.detik.net.id/community/media/visual/2025/09/15/polisi-menangkap-pria-berinisial-fha-35-yang-mencoba-mencuri-motor-milik-pelajar-di-kemayoran-jakarta-pusat-jakpus-dok-polisi-1757918030468_43.jpeg?w=210&q=90;"Polisi menangkap pria berinisial FHA (35) yang mencoba mencuri motor milik pelajar di Kemayoran, Jakarta Pusat (Jakpus). Pelaku melakukan aksinya dengan berpura-pura mencari musuh. Kapolres Metro Jakarta Pusat Kombes Susatyo Purnomo Condro mengatakan peristiwa itu terjadi pada Minggu (14/9/2025) kemarin. Pelaku saat itu memepet kedua korban HCE (16) dan JMC (16). ""Pelaku memepet kendaraan korban dan memaksa mereka menepi. Dengan alasan hendak membuktikan bahwa korban bukan teman musuhnya,"" kata Susatyo kepada wartawan, Senin (15/9). SCROLL TO CONTINUE WITH CONTENT Saat itu pelaku memisahkan kedua remaja itu dan memintanya untuk turun dari motor. Saat pelaku hendak melarikan diri, korban mencoba merebut motornya kembali hingga pelaku terjatuh. Pelaku bisa diamankan warga sekitar. ""Kami mengingatkan para pelajar untuk selalu berhati-hati dan segera mencari bantuan jika merasa terancam. Kepada para orang tua, kami imbau untuk mengawasi dan tidak membiarkan anak-anak di bawah umur mengendarai sepeda motor sendirian. Kejahatan seperti ini dapat dicegah dengan kewaspadaan dan partisipasi aktif masyarakat,"" jelasnya. Kapolsek Kemayoran Kompol Agung Adriansyah menjelaskan pelaku melancarkan aksinya dengan modus menuduh korban sebagai teman musuhnya. Polisi meminta masyarakat berhati-hati. ""Pelaku menggunakan tipu muslihat dengan menuduh korban sebagai 'teman musuh' untuk memisahkan dan menguasai kendaraan mereka. Beruntung, warga segera bertindak sehingga pelaku dapat diamankan,"" imbuhnya. Saat ini pelaku sudah ditetapkan sebagai tersangka dan ditahan. Dia dijerat dengan Pasal 365 KUHP tentang pencurian dengan kekerasan dan/atau Pasal 378 KUHP tentang Penipuan.  Simak juga Video: Pria di Lumajang Babak Belur Dihajar Warga saat Kepergok Curi Motor  [Gambas:Video 20detik]  ";3
Penghuni Kos Dengar Teriakan Sebelum Mahasiswi Ditemukan Tewas di Ciracas;;Senin, 15 Sep 2025 13:32 WIB;Rizky Adha Mahendra - detikNews;https://news.detik.com/berita/d-8112758/penghuni-kos-dengar-teriakan-sebelum-mahasiswi-ditemukan-tewas-di-ciracas;https://akcdn.detik.net.id/community/media/visual/2025/09/15/tkp-penemuan-mayat-wanita-dalam-indekos-di-ciracas-jakarta-timur-1757912595795_43.jpeg?w=210&q=90;"Seorang mahasiswi berinisial IM (23) ditemukan tewas di kamar kosnya di Kecamatan Ciracas, Jakarta Timur (Jaktim). Penghuni kos lain disebut sempat mendengar suara gaduh dari kamar IM. Hal itu disampaikan oleh pemilik kos, Syarif, yang mendapat cerita dari para penghuni kos lain. Dia mengatakan penghuni kos yang lain mendengar suara gaduh seperti benda jatuh serta teriakan korban. ""Jumat dini hari itu menurut pengakuan tetangga kos di kamar itu ada gaduh, kayak ada benda jatuh, akhirnya ada suara teriakan si korban,"" kata Syarif kepada wartawan di lokasi, Senin (15/9/2025). SCROLL TO CONTINUE WITH CONTENT Dia mengatakan ada suara laki-laki dan diduga sedang bertengkar. Dia mengatakan salah satu penghuni juga meminta tolong agar dia mengecek ke kamar itu. ""Katanya ada suara cowok, dia keluar ke atas minta tolong bahwa ada orang di dalam kayaknya lagi berantem,"" jelasnya.  Saat hendak menghampiri korban, terlihat seorang pria yang diduga merupakan pacar korban yang masih berusia 16 tahun. Syarif menyebutkan warga sempat mengejar pria itu. ""Akhirnya katanya cowoknya korban keluar,"" sebutnya. Polisi kini telah menangkap remaja berinisial FF (16) atas dugaan pembunuhan terhadap IM. FF diduga menganiaya korban hingga tewas di kosan di Ciracas pada Jumat (12/9). ""Kami menangkap terduga pelaku, FF (16), pada Sabtu, 13 September 2025, sekitar jam 00.15 WIB,"" kata Kasat Reskrim Polres Metro Jakarta Timur AKBP Dicky Fertoffan, dilansir Antara, Minggu (14/9).  Saksikan Live DetikSore : Simak juga Video: Polisi Ungkap Motif Alvi Maulana Mutilasi Pacar hingga Ratusan Potong  [Gambas:Video 20detik]  ";3
Menkop Ungkap Kopdes Merah Putih Sudah Bisa Cairkan Pinjaman dari Bank;;Senin, 15 Sep 2025 13:32 WIB;Lisye Sri Rahayu - detikNews;https://news.detik.com/berita/d-8112757/menkop-ungkap-kopdes-merah-putih-sudah-bisa-cairkan-pinjaman-dari-bank;https://akcdn.detik.net.id/community/media/visual/2025/09/15/menko-pangan-zulhas-menkeu-purbaya-dan-menkop-ferry-juliantono-1757917922680_43.jpeg?w=210&q=90;"Menteri Koperasi (Menkop) sekaligus Koordinator Ketua Pelaksana Harian Satgas Koperasi Desa/Kelurahan Merah Putih (KDKMP) Ferry Juliantono mengatakan koperasi sudah bisa mencarikan pinjaman dana dari bank. Dia meminta agar pengurus segera menyusun proposal. ""Telah disepakati pencairan pinjaman KDKMP kepada Bank Himbara sebagai bank penyalur yang sudah dapat dilakukan mulai hari ini. Untuk itu pengurus KDKMP diharapkan untuk menyusun proposal bisnisnya dan diajukan ke Bank Himbara untuk pengajuan pembiayaan,"" kata Ferry kepada wartawan, Senin (15/9/2025).  SCROLL TO CONTINUE WITH CONTENT Hal itu diungkap Ferry usai menghadiri Rapat Koordinasi KDKMP yang dipimpin Menteri Koordinator Bidang Pangan Zulkifli Hasan di kantor Kementerian Koordinator Bidang Pangan hari ini. Hadir dalam rapat Menteri Keuangan Purbaya Yudhi Sadewa. Selain itu, rapat juga diikuti oleh Menteri Kesehatan Budi Gunadi Sadikin, Kepala Badan Pangan Nasional Arief Prasetyo, Wakil Menteri Desa dan Pembangunan Daerah Tertinggal Ahmad Riza Patria, Wakil Menteri Dalam Negeri Bima Arya, Wakil Menteri Kesehatan Dante Saksono, Wakil Menteri Kelautan dan Perikanan Didit Herdiawan, Wakil Menteri PAN-RB Purwadi Arianto dan COO Danantara Dony Oskaria. Sebelumnya, Menko Pangan Zulhas mengatakan pemerintah sudah menyalurkan Rp 200 triliun ke himpunan bank milik negara atau bank himbara. Dia mendorong agar pinjaman koperasi desa Merah Putih segera dipercepat. ""Pemerintah sudah menyalurkan Rp 200 triliun lewat bank Himbara, dan sebagian dana itu khusus untuk pinjaman ke Koperasi Desa/Kelurahan Merah Putih. Jadi modalnya sudah ada, aturannya juga sudah jelas. Sekarang yang paling penting adalah percepatan penyaluran pinjaman,"" tegas Zulhas, Senin (15/9). Zulhas mengingatkan agar tidak ada dana yang tertahan di perbankan. Hal itu, kata dia, agar terasa dampaknya pada sektor riil, salah satunya melalui koperasi Merah Putih. ""Jangan sampai dana mengendap di bank sementara Koperasi Merah Putih butuh stok pupuk, stok gas melon, dan modal usaha,"" tambahnya.  Simak juga Video: Menkeu Purbaya Ungkap Prabowo Setuju Rp 200 T Diguyur ke Bank  [Gambas:Video 20detik]  ";3
Pemohon SKCK Membeludak, Polres Meranti Beri Pelayanan Ekstra;;Senin, 15 Sep 2025 13:31 WIB;Mei Amelia R - detikNews;https://news.detik.com/melindungi-tuah-marwah/d-8112755/pemohon-skck-membeludak-polres-meranti-beri-pelayanan-ekstra;https://akcdn.detik.net.id/community/media/visual/2025/09/15/pemohon-skck-di-polres-meranti-meningkat-polisi-beri-pelayanan-ekstra-1757917735185_43.jpeg?w=210&q=90;"Pemohon surat keterangan catatan kepolisian (SKCK) di Polres Kepulauan Meranti mengalami peningkatan seiring dibukanya pendaftaran Pegawai Pemerintah dengan Perjanjian Kerja (PPPK) paruh waktu. Kasat Intelkam Polres Kepulauan Meranti Iptu Roly Irfan menyampaikan bahwa kebijakan pelayanan tambahan ini dilakukan untuk mengakomodir tingginya permintaan SKCK dari para pelamar. ""Sejak dibukanya rekrutmen PPPK paruh waktu jumlah pemohon SKCK meningkat tajam. Untuk itu, kami membuka pelayanan ekstra, termasuk di luar jam kerja normal, agar masyarakat bisa lebih mudah mengurus dokumen,"" ujar Iptu Roly, Senin (15/9/2025). SCROLL TO CONTINUE WITH CONTENT Sejak pagi para pemohon pembuatan SKCK memadati Polres Kepulauan Meranti. Polres Meranti menyiapkan tenda di halaman Mapolres serta memindahkan pelayanan di aula Tantya Sudhirajatu untuk menampung meningkatnya jumlah pemohon saat itu. Polres Meranti juga menyediakan konsumsi snack serta minuman di tenda yang bisa dikonsumsi para pemohon yang hadir. Masyarakat yang mengantre juga bisa mendapatkan pelayanan kesehatan hingga pelayanan BPJS di lokasi.   ""Karena ada kemungkinan yang harus melengkapi keikutsertaan BPJS mereka, sehingga kita juga bekerjasama sehingga layanan BPJS juga kita sediakan saat ini."" Jelasnya. Kapolres Meranti AKBP Aldi Alfa Faroqi memastikan proses penerbitan SKCK tetap berjalan sesuai prosedur dengan mengedepankan kecepatan, ketepatan, dan transparansi. Selain itu, pemohon tidak perlu khawatir akan keterlambatan karena petugas telah disiagakan khusus untuk mempercepat pelayanan. ""SKCK ini menjadi salah satu syarat penting dalam seleksi PPPK. Kami ingin memastikan bahwa semua masyarakat yang berhak memiliki kesempatan yang sama untuk melengkapi persyaratan administrasi,"" kata Aldi. Ia juga menuturkan bahwa layanan ini akan terus ada hingga proses pengurusan persyaratan PPPK Paruh Waktu selesai. Pelayanan ekstra SKCK ini mendapat apresiasi dari masyarakat, khususnya para pelamar PPPK paruh waktu, yang merasa terbantu dengan fleksibilitas waktu pengurusan. Seperti diketahui ada 1.686 formasi PPPK Paruh waktu yang harus penyelesaian pemberkasan hingga tanggal 22 September 2025 mendatang.   Tonton juga Video: Mulai 1 Maret 2024 BPJS Kesehatan Jadi Syarat Bikin SKCK  [Gambas:Video 20detik]  ";3
Bali, Banjir, dan Jalan Pulang Kita;;Senin, 15 Sep 2025 13:30 WIB;;https://news.detik.com/kolom/d-8112189/bali-banjir-dan-jalan-pulang-kita;https://akcdn.detik.net.id/community/media/visual/2025/09/14/potret-kerusakan-akibat-banjir-di-bali-1757818331894_43.jpeg?w=210&q=90;"Beberapa hari terakhir, kita semua dikejutkan dengan kabar dari Bali, pulau yang selama ini kita kenal sebagai surga wisata dunia, yang ternyata rapuh di hadapan derasnya air hujan. Curah hujan ekstrim sejak awal September 2025 memicu banjir bandang dan longsor di berbagai wilayah, menghanyutkan rumah, menutup akses jalan, merusak jembatan, bahkan sempat mengganggu jalur menuju bandara. Korban jiwa tercatat belasan orang, ratusan warga harus mengungsi, dan ribuan orang lainnya mengalami dampak yang membuat kehidupan sehari-hari mereka berantakan. Bayangkan saja, hanya dalam hitungan jam, hujan yang turun bisa setara dengan curah hujan satu bulan penuh, sehingga tidak ada lagi ruang bagi tanah untuk menelan air, tidak ada cukup waktu bagi sungai untuk mengalirkannya, dan tidak ada cukup saluran kota untuk menampungnya. SCROLL TO CONTINUE WITH CONTENT Kita tentu sepakat bahwa hujan deras adalah peristiwa alam, namun yang membuatnya menjadi bencana besar adalah ketika hujan itu jatuh di tanah yang sudah padat bangunan, di atas aliran sungai yang sudah menyempit oleh bangunan pariwisata, atau di lereng yang gundul karena hutan sudah dikorbankan demi villa dan hotel. Di situlah kita harus jujur mengakui bahwa banjir di Bali kali ini bukan semata soal langit yang sedang marah, melainkan juga soal bagaimana kita membangun pulau ini selama puluhan tahun terakhir. Semakin banyak sawah berubah jadi beton, semakin sempit ruang sungai karena terhimpit bangunan, semakin besar pula risiko bencana yang kita tanggung. Dan ketika perubahan iklim datang membawa pola hujan yang makin tidak menentu, kita dipaksa melihat kenyataan bahwa Bali, yang selama ini kita banggakan sebagai destinasi dunia, ternyata menyimpan kerentanan yang besar. Kabar dari BMKG menyebut musim hujan kali ini bisa lebih panjang dan ekstrem dibanding tahun-tahun sebelumnya. Artinya, banjir yang menelan korban dan kerugian ekonomi di Bali tidak bisa kita anggap sebagai musibah sesaat, melainkan tanda peringatan keras bahwa kita sudah memasuki era baru, era ketika perubahan iklim nyata-nyata mengetuk pintu rumah kita. Persoalannya sekarang, apakah kita hanya akan bersedih dan menyalahkan hujan, atau kita mau belajar, membenahi, dan membangun kesiapan baru menghadapi tantangan zaman. Dari Mitigasi, Energi Bersih, hingga Ekonomi Warga Jika kita menengok bagaimana pemerintah daerah dan pusat merespons bencana ini, tentu ada hal-hal yang patut kita apresiasi. Badan Nasional Penanggulangan Bencana, Basarnas, TNI, Polri, hingga BPBD Bali bergerak cepat mengevakuasi korban, membuka akses jalan, dan memberikan bantuan darurat. Inilah bukti bahwa sistem tanggap darurat kita sudah jauh lebih baik dibanding puluhan tahun lalu. Tetapi, pertanyaan pentingnya adalah: apakah kita sudah cukup kuat dalam hal pencegahan, atau kita masih berkutat di hilir, sibuk setelah bencana datang, namun abai sebelum bencana terjadi? Mitigasi adalah kunci, dan sayangnya di sinilah kita masih lemah. Tata ruang di Bali, terutama di kawasan pariwisata, seringkali lebih tunduk pada kepentingan investasi ketimbang rencana mitigasi bencana. Sungai yang seharusnya dilindungi, malah dijadikan pemandangan belakang hotel; hutan yang seharusnya menjadi penyangga air, malah ditebang untuk vila-vila mewah; drainase kota yang seharusnya diperluas, malah tersumbat oleh tumpukan pembangunan yang tidak terkendali. Padahal kita tahu, tanpa ruang terbuka hijau dan resapan air, hujan ekstrem apa pun pasti akan berujung banjir. Dalam konteks inilah, transisi energi yang selama ini banyak dibicarakan di Bali juga tidak bisa kita pandang sebelah mata. Bali sebenarnya sudah punya visi yang luar biasa: peta jalan menuju 100 persen energi terbarukan pada tahun 2045. Beberapa desa sudah lebih dulu memulainya, dengan pembangkit listrik tenaga surya (PLTS) yang memberi penerangan bagi warga sekaligus menekan ketergantungan pada jaringan listrik yang rentan padam saat bencana. Bayangkan jika energi bersih ini diperluas ke banyak desa, maka saat banjir datang dan listrik utama padam, warga desa tetap bisa hidup dengan penerangan, rumah sakit tetap bisa melayani pasien, dan UMKM tetap bisa berproduksi. Energi bersih bukan hanya soal menekan emisi karbon, tapi juga soal ketahanan sosial di tengah bencana. Dampak ekonomi dari banjir di Bali sangat besar, dan ini harus kita pahami bukan hanya dalam hitungan rupiah yang hilang, tetapi dalam penderitaan harian warga. Pariwisata yang menjadi nadi ekonomi Bali tentu terpukul: wisatawan membatalkan kunjungan, hotel dan restoran merugi, pekerja harian kehilangan penghasilan. Tidak hanya itu, petani di desa-desa terdampak kehilangan hasil panen, UMKM yang bergantung pada pasokan lokal harus menutup usaha, dan ribuan keluarga kehilangan modal kecil yang selama ini menjadi penopang hidup. Inilah wajah nyata bencana: ia tidak hanya menghanyutkan rumah, tapi juga menghanyutkan harapan. Karena itu, membangun mitigasi bencana dan transisi energi bersih tidak boleh hanya dilihat sebagai agenda teknis pemerintah, tetapi sebagai upaya menyelamatkan ekonomi rakyat kecil. Kita harus melihat bahwa setiap rupiah yang diinvestasikan untuk perbaikan drainase, penghijauan hulu sungai, pembangunan PLTS desa, atau edukasi kebencanaan, sesungguhnya adalah investasi untuk melindungi petani, nelayan, pedagang kaki lima, dan buruh pariwisata yang menjadi tulang punggung Bali. Peraturan Desa, Keadilan Iklim, dan Amanat Konstitusi Di titik inilah gagasan Akar Desa Indonesia tentang peraturan desa transisi energi dan keadilan iklim menemukan relevansinya. Selama ini, desa sering dipandang hanya sebagai objek pembangunan, padahal desa justru adalah garda terdepan menghadapi bencana dan perubahan iklim. Desa tahu persis aliran air sungai di wilayahnya, desa tahu tanah mana yang rawan longsor, desa tahu kebiasaan masyarakatnya, dan desa pula yang pertama kali menanggung derita ketika banjir melanda. Maka, memberi kewenangan dan landasan hukum bagi desa untuk membuat peraturan tentang transisi energi dan keadilan iklim adalah langkah yang sangat strategis. Bayangkan sebuah desa di Bali memiliki peraturan yang mengatur larangan membangun di bantaran sungai, mewajibkan konservasi hutan adat, memanfaatkan dana desa untuk PLTS atap bersama, dan membuat dana cadangan khusus untuk membantu warga paling rentan saat bencana. Bayangkan pula jika desa-desa wisata di Bali mewajibkan setiap hotel kecil atau homestay memasang sistem pengelolaan air hujan agar tidak langsung membanjiri jalan desa. Semua itu bisa diatur lewat peraturan desa, sehingga tidak menunggu instruksi dari atas, melainkan tumbuh dari bawah, dari kebutuhan riil masyarakat desa. Inilah yang disebut sebagai keadilan iklim: memastikan bahwa kelompok paling rentan petani kecil, buruh pariwisata, pedagang pasar, dan anak-anak tidak dibiarkan menanggung beban paling besar dari krisis iklim. Jika desa punya aturan, maka desa punya pegangan hukum untuk mengalokasikan dana, mengorganisir warga, dan bernegosiasi dengan pihak luar yang ingin berinvestasi. Bali, dengan kearifan lokalnya seperti Tri Hita Karana yang menekankan harmoni manusia dengan alam, sebenarnya punya modal budaya yang sangat kuat untuk mewujudkan gagasan ini. Dan jika kita tarik lebih jauh, semua ini sejatinya adalah amanat konstitusi kita. UUD 1945 menegaskan bahwa negara wajib melindungi segenap bangsa Indonesia dan seluruh tumpah darah Indonesia. Perlindungan itu tidak hanya dalam arti menjaga batas negara dari ancaman luar, tetapi juga menjaga setiap warganya dari ancaman bencana. Negara juga ditugaskan untuk mengelola bumi, air, dan kekayaan alam untuk sebesar-besar kemakmuran rakyat. Maka ketika banjir menghancurkan rumah warga, ketika sawah petani tenggelam, ketika pekerja pariwisata kehilangan penghasilan, itu semua adalah alarm yang mengingatkan bahwa amanat konstitusi belum sepenuhnya kita jalankan. Konstitusi juga mengajarkan tentang keadilan sosial bagi seluruh rakyat Indonesia. Dalam konteks perubahan iklim, keadilan sosial itu berarti memastikan bahwa generasi mendatang tidak mewarisi bumi yang lebih rusak daripada yang kita nikmati hari ini. Banjir di Bali adalah cermin kecil dari apa yang akan semakin sering terjadi jika kita terus menunda adaptasi dan transisi energi. Maka, membangun peraturan desa, memperluas energi bersih, memperkuat tata ruang, dan mengedepankan keadilan iklim bukan sekadar program pemerintah, melainkan bentuk nyata dari kita menepati janji konstitusi. Jalan Pulang Kita Bali adalah wajah kita di mata dunia, tapi lebih dari itu, Bali adalah rumah bagi jutaan orang yang menggantungkan hidupnya pada sawah, laut, dan pariwisata. Banjir yang melanda Bali hari ini mengajarkan kita bahwa rumah seindah apa pun bisa roboh jika pondasinya rapuh. Pondasi itu bukan sekadar beton, tapi kebijakan yang berkeadilan, tata ruang yang berpihak pada alam, energi yang bersih dan tangguh, serta desa-desa yang berdaya menghadapi perubahan iklim. Kita tidak bisa lagi menunda, sebab perubahan iklim sudah hadir di depan mata. Kita tidak bisa lagi menganggap bencana sebagai kejadian sesaat, sebab pola cuaca ekstrem kini menjadi normal baru. Yang bisa kita lakukan adalah belajar, berbenah, dan kembali pada jalan pulang kita: jalan menuju harmoni dengan alam, jalan menuju energi bersih, jalan menuju keadilan sosial, jalan menuju amanat konstitusi. Jika Bali bisa memulai dari desa, dengan peraturan desa transisi energi dan keadilan iklim, maka Bali bukan hanya bisa pulih dari banjir, tetapi juga bisa menjadi teladan dunia tentang bagaimana sebuah pulau kecil berani berdiri menghadapi krisis iklim. Dan pada akhirnya, keberanian itu bukan hanya untuk Bali, tapi untuk kita semua, bangsa Indonesia, yang ingin tetap berdiri tegak di tengah badai zaman. Rifqi Nuril Huda, Alumni Magister Hukum Sumber Daya Alam Universitas Indonesia. Direktur Eksekutif Institute of Energy and Development Studies (IEDS) dan Ketua Umum Akar Desa Indonesia  Simak juga Video Menpar Pastikan Wisatawan Masih Berdatangan ke Bali Meski Banjir  [Gambas:Video 20detik]  ";3
Polres Serang Gelar Patroli, Imbau Pemuda Kumpul hingga Larut Malam Bubar;;Senin, 15 Sep 2025 13:27 WIB;Arief Ikhsanudin - detikNews;https://news.detik.com/berita/d-8112749/polres-serang-gelar-patroli-imbau-pemuda-kumpul-hingga-larut-malam-bubar;https://akcdn.detik.net.id/community/media/visual/2025/09/15/polres-serang-gelar-patroli-1757917591946_43.jpeg?w=210&q=90;"Polres Serang menggelar patroli untuk menjaga keamanan wilayah pada malam hari. Polisi pun mendatangi kelompok pemuda yang berkumpul hingga larut malam dan meminta mereka membubarkan diri. Patroli kegiatan rutin yang ditingkatkan (KRYD) bertempat di Kawasan Industri Modern (KIM) Cikande, Kabupaten Serang, pada Minggu (14/9/2025) malam hingga Senin (15/9) dini hari. Patroli tersebut dipimpin oleh Kasat Tahti Polres Serang, Ipda Ayib. Tim patroli mengunjungi beberapa lokasi rawan gangguan keamanan dan ketertiban masyarakat (Kamtibmas). Patroli itu pun merupakan arahan dari Kapolres Serang AKBP Condro Sasongko. SCROLL TO CONTINUE WITH CONTENT Selama patroli tersebut, polisi tidak menemukan gangguan keamanan. ""Patroli tersebut adalah kegiatan rutin yang ditingkatkan (KRYD) dalam rangka menciptakan situasi Kamtibmas yang aman dan kondusif,"" tutur Padal. Mereka pun sempat mendatangi beberapa pemuda yang berkumpul hingga larut malam dan dini hari. Mereka bergerombol hingga belasan orang dengan membawa sepeda motor yang di parkir di pinggir jalan. Petugas berdiskusi secara humanis dengan kelompok pemuda tersebut. Polisi mengimbau mereka untuk membubarkan diri dan pulang. ""Hal ini untuk menciptakan situasi Kamtibmas yang lebih aman dan kondusif,"" katanya.  Simak juga Video Polda Metro Jaya Gelar Patroli Skala Besar, Jaga Keamanan Jakarta  [Gambas:Video 20detik]  ";4
