title;category;published_date;author;article_url;image_url;content;source_page
Gubernur Pramono Buka Lomba Ketangkasan Pemadam Jakarta Fire Safety Challenger;;Senin, 15 Sep 2025 12:00 WIB;Pradita Utama - detikNews;https://news.detik.com/foto-news/d-8112277/gubernur-pramono-buka-lomba-ketangkasan-pemadam-jakarta-fire-safety-challenger;https://akcdn.detik.net.id/community/media/visual/2025/09/15/gubernur-pramono-buka-lomba-ketangkasan-pemadam-jakarta-fire-safety-challenger-1757906494767_43.jpeg?w=210&q=90;Jakarta - Gubernur DKI Jakarta, Pramono Anung, membuka ajang Jakarta Fire Safety Challenger 2025 di Kantor Dinas Pemadam Kebakaran dan Penyelamatan, Jakarta.;5
Uji Coba GT Fatmawati Gratis demi Urai Macet di TB Simatupang hingga Jumat;;Senin, 15 Sep 2025 12:00 WIB;Brigitta Belia Permata Sari - detikNews;https://news.detik.com/berita/d-8112472/uji-coba-gt-fatmawati-gratis-demi-urai-macet-di-tb-simatupang-hingga-jumat;https://akcdn.detik.net.id/community/media/visual/2025/09/15/gubernur-dki-jakarta-pramono-anung-1757912382462_43.jpeg?w=210&q=90;"Pemprov DKI Jakarta tengah melakukan uji coba rekayasa lalu lintas penggunaan satu lajur paling kiri di Gerbang Tol Fatmawati 2 secara gratis untuk mengurai kemacetan di Jalan TB Simatupang hari ini. Uji coba itu diperuntukkan bagi kendaraan roda empat secara gratis hingga Jumat (19/9/2025). ""Kita melakukan uji coba sampai dengan hari Jumat. Ketika fase uji coba tersebut, masyarakat melewati jalur itu maka akan digratiskan,"" kata Gubernur DKI Jakarta Pramono di kantor Damkar DKI Jakarta, Senin (15/9). Pramono menegaskan rekayasa lalu lintas ini bukan sekadar solusi jangka pendek, tapi juga bagian dari upaya penataan kawasan yang ditargetkan selesai dalam waktu dekat. SCROLL TO CONTINUE WITH CONTENT ""Saya mengharapkan penyelesaian untuk Simatupang tidak hanya bersifat temporer, jangka panjang, jangka pendek, maka untuk itu saya minta bulan Oktober proyek yang dilakukan oleh pemerintah bisa diselesaikan. Dan mudah-mudahan akan selesai,"" ucapnya. Adapun rekayasa lalu lintas dilakukan pada 15-19 September 2025. Uji coba akan berlangsung pada pukul 17.00-20.00 WIB. Sebelumnya, Dinas Perhubungan (Dishub) DKI Jakarta akan melakukan sejumlah rekayasa lalu lintas demi mengurai kepadatan di Jalan TB Simatupang segmen Simpang Fatmawati, Lebak Bulus, Jakarta Selatan. Penerapan rekayasa lalu lintas ini berlaku hari ini. ""Masyarakat dari Jalan Fatmawati yang akan menuju Lebak Bulus, selain menggunakan jalan eksisting, dapat juga menggunakan tambahan satu lajur paling kiri dari gerbang tol Fatmawati 2 dan tanpa dipungut biaya,"" kata Kepala Dinas Perhubungan (Dishub) DKI Jakarta, Syafrin Liputo, dalam keterangan tertulis, Minggu (14/9).  Simak Video: Sore Ini Akan Ada Rekayasa Lalin di TB Simatupang Demi Urai Macet  [Gambas:Video 20detik]";5
Ada Uji Coba Rekayasa Lalin di TB Simatupang Sore Ini, Cek Infonya!;;Senin, 15 Sep 2025 11:59 WIB;Kanya Anindita Mutiarasari - detikNews;https://news.detik.com/berita/d-8112470/ada-uji-coba-rekayasa-lalin-di-tb-simatupang-sore-ini-cek-infonya;https://akcdn.detik.net.id/community/media/visual/2025/08/27/titik-galian-baru-di-jalan-tb-simatupang-jakarta-selatan-1756270860337_43.jpeg?w=210&q=90;"Uji coba rekayasa lalu lintas di Jalan TB Simatupang segmen Simpang Fatmawati - Lebak Bulus, Jakarta Selatan, akan dimulai sore ini. Pelaksanaan rekayasa lalu lintas di lokasi tersebut berlangsung sampai tanggal 19 September 2025, tepatnya pada pukul 17.00-20.00 WIB. Berikut informasi selengkapnya.  SCROLL TO CONTINUE WITH CONTENT Mengutip dari akun Instagram Dishub DKI Jakarta (@dishubdkijakarta), berikut hal-hal yang perlu diketahui terkait pelaksanaan uji coba rekayasa lalu lintas di Jalan TB Simatupang.  Mulai sore ini, Dinas Perhubungan (Dishub) DKI Jakarta akan melakukan uji coba rekayasa lalu lintas untuk mengurai kepadatan di Jalan TB Simatupang ,tepatnya di sekitar Simpang Fatmawati, Lebak Bulus, Jakarta Selatan. Warga berharap rekayasa lalin itu bisa mengurai macet. ""Saya menyambut baik adanya rekayasa lalin di Jalan TB Simatupang, khususnya di dekat Stasiun MRT Fatmawati. Dengan penggratisan biaya tol, tentu bisa membagi ruang kendaraan roda empat yang memang memiliki rencana ke arah Lebak Bulus,"" ujar warga bernama Dzaky (25) di TB Simatupang, Jaksel, Senin (15/9/2025).  Simak Video: Sore Ini Akan Ada Rekayasa Lalin di TB Simatupang Demi Urai Macet  [Gambas:Video 20detik]  ";6
Cara Cek Informasi Cuaca Real Time via Situs dan Aplikasi BMKG;;Senin, 15 Sep 2025 11:59 WIB;Widhia Arum Wibawana - detikNews;https://news.detik.com/berita/d-8112789/cara-cek-informasi-cuaca-real-time-via-situs-dan-aplikasi-bmkg;https://akcdn.detik.net.id/community/media/visual/2024/10/01/aplikasi-cuaca_43.jpeg?w=210&q=90;Informasi cuaca menjadi salah satu kebutuhan penting, terutama bagi masyarakat yang beraktivitas di luar ruangan. Kini, masyarakat bisa dengan mudah memantau prakiraan cuaca secara real time secara online melalui smartphone. Badan Meteorologi, Klimatologi, dan Geofisika (BMKG) menyediakan layanan online yang bisa diakses kapan saja, baik melalui situs web maupun aplikasi di smartphone. Dengan begitu, data yang diperoleh lebih akurat dan sesuai pembaruan terbaru.  SCROLL TO CONTINUE WITH CONTENT Situs web resmi BMKG yang menyajikan informasi prakiraan cuaca secara real time dapat diakses melalui https://cuaca.bmkg.go.id..Berikut langkah-langkahnya: Selain melalui situs web, BMKG juga memiliki aplikasi resmi bernama Info BMKG yang bisa diunduh gratis di Play Store maupun App Store. Berikut cara menggunakannya: Masyarakat hanya perlu mengakses situs resmi BMKG atau mengunduh aplikasi Info BMKG di smartphone. Dengan informasi cuaca real time ini, aktivitas sehari-hari dapat direncanakan dengan lebih aman dan nyaman.;6
Awal Mula Bintang Yahudi Jadi Simbol Holocaust;;Senin, 15 Sep 2025 11:57 WIB;Deutsche Welle (DW) - detikNews;https://news.detik.com/dw/d-8112464/awal-mula-bintang-yahudi-jadi-simbol-holocaust;https://akcdn.detik.net.id/community/media/visual/2025/09/15/bagaimana-bintang-yahudi-jadi-simbol-holocaust-1757912242312_43.jpeg?w=210&q=90;"Di era Nazi Jerman, Bintang Daud, yang dalam sejarah tak pernah eksklusif diklaim milik Bangsa Yahudi, tiba-tiba menjadi simbol Holocaust, salah satu kasus pembersihan etnis paling brutal dalam sejarah modern. Sejak Undang-undang Rasial Nuremberg disahkan pada 1935, warga Yahudi mulai dijauhkan dari kehidupan sosial. Legislasi ini menetapkan secara rinci siapa yang tergolong Yahudi penuh, setengah Yahudi, campuran tingkat pertama atau kedua, atau ""Yahudi sah"" — sebagian besar kemudian diwajibkan mengenakan bintang. SCROLL TO CONTINUE WITH CONTENT Sebelum perang berkobar, Reinhard Heydrich, kepala kantor pusat keamanan Nazi, sudah mengkaji bagaimana membuat ""musuh di dalam"" Jerman ""bisa terlihat oleh dunia."" Tak lama setelah Reichspogromnacht pada November 1938, ketika sinagoga dibakar dan toko-toko Yahudi dihancurkan, Heydrich menulis, ""setiap Yahudi menurut Undang-Undang Nuremberg harus mengenakan tanda tertentu. Ini salah satu cara yang mempermudah banyak hal."" Bagi rejim Nazi, Bintang Daud memudahkan aparat mengidentifikasi orang Yahudi dan mendeportasi mereka ke kamp konsentrasi. Kewajiban ini tidak hanya berlaku di Jerman, tapi juga wilayah yang diduduki. Pada awal perang, September 1939, warga Yahudi di Polandia yang diduduki Nazi diwajibkan memakai gelang putih dengan bintang biru. Seiring pendudukan di negara lain, kewajiban mengenakan tanda pengenal bagi warga Yahudi diperluas. Sebelum perang, Adolf Hitler awalnya sempat ragu. Pada tahun 1937, dia mengatakan kepada pejabat NSDAP, betapa ""masalah penandaan ini telah dipertimbangkan selama dua, tiga tahun dan suatu hari nanti pasti akan dilakukan. Hidung kita harus bisa menicum: apa yang bisa kita lakukan, apa yang tidak bisa kita lakukan?"" Keraguan itu menghilang seiring dimulainya perang. Pada tahun 1941, Menteri Propaganda Joseph Goebbels menyarankan sekali lagi agar Hitler menyetujui penandaan orang Yahudi, dan pada pertengahan Agustus, Hitler memberikan persetujuan. Peraturan polisi mulai berlaku pada 1 September 1941. Peraturan itu menetapkan secara rinci, ""Bintang enam berukuran sebesar telapak tangan, dengan pinggiran hitam, dari kain kuning, bertuliskan 'Jude' dengan tinta hitam, harus dijahit terlihat di sisi kiri dada pakaian."" Peraturan ini berlaku bagi semua warga Yahudi berusia enam tahun ke atas, menurut Undang-Undang Nuremberg. Mulai saat itu, mereka ""dilarang muncul di muka umum tanpa bintang Yahudi."" Siapa pun yang mencoba menyembunyikannya dengan tas, mantel, atau syal akan menghadapi hukuman berat dari Gestapo, yang mengawasi kepatuhan dengan ketat. Victor Klemperer, seorang romanis berdarah Yahudi, sejatinya telah berpindah ke agama Protestan sebelum Perang Dunia I. Tapi hal itu tidak mengubah penilaian Nazi, bagi mereka, dia tetap seorang Yahudi. Klemperer kehilangan jabatan guru besar di Dresden pada 1935 dan ikut dipaksa mengenakan bintang pengenal. Dalam buku hariannya dia menulis: ""Kemarin, ketika Eva menjahit bintang Yahudi, saya mengalami ledakan putus asa. Saraf Eva juga tegang. Saya sendiri merasa hancur, tak menemukan ketenangan."" Penyintas Holocaust Inge Deutschkron mengingat pada 2013, betapa ""mayoritas orang Jerman yang saya temui di jalanan Berlin menoleh jika melihat bintang ini pada saya, atau seakan tidak melihat saya, atau memalingkan muka."" Bintang itu, katanya, menciptakan isolasi, diskriminasi, kontrol. Kewajiban mengenakan bintang cuma langkah awal persiapan Nazi untuk menjalankan ""Solusi Akhir bagi Masalah Yahudi,"" yakni pembasmian total. Bersamaan dengan itu, orang Yahudi dilarang meninggalkan lingkungan tempat tinggal tanpa izin polisi. Segalanya tersusun rapi untuk Holocaust. Tidak mengherankan, deportasi ke kamp pembantaian dimulai hanya sebulan kemudian, Oktober 1941. Victor Klemperer dan Inge Deutschkron selamat, jutaan lainnya tidak. Artikel ini pertama kali terbit dalam Bahasa Jerman Diadaptasi oleh Rizki Nugraha Editor: Yuniman Farid dan  Tonton juga Video Cuplak-Cuplik: Israel, Yahudi, dan Zionisme  [Gambas:Video 20detik]   ";6
KPU Tak Bisa Buka Dokumen Ijazah Capres-Cawapres Tanpa Izin;;Senin, 15 Sep 2025 11:54 WIB;Wilda Hayatun Nufus - detikNews;https://news.detik.com/berita/d-8112447/kpu-tak-bisa-buka-dokumen-ijazah-capres-cawapres-tanpa-izin;https://akcdn.detik.net.id/community/media/visual/2021/03/09/ilustrasi-kpu-1_43.jpeg?w=210&q=90;"Komisi Pemilihan Umum (KPU) mengeluarkan putusan perihal penetapan dokumen persyaratan calon presiden (capres) dan calon wakil presiden (cawapres) sebagai informasi publik yang dikecualikan. Ada beberapa dokumen capres-cawapres yang tidak bisa dibuka ke publik tanpa persetujuan, termasuk perihal ijazah. Hal tersebut tertuang dalam Keputusan KPU RI Nomor 731 Tahun 2025 tentang Penetapan Dokumen Persyaratan Pasangan Calon Presiden dan Wakil Presiden sebagai Informasi Publik yang Dikecualikan KPU dikutip, Senin (15/9/2025). Surat itu ditandatangani Ketua KPU Affifuddin tertanggal 21 Agustus 2025. ""Informasi publik sebagaimana dimaksud dalam Diktum Kedua dikecualikan selama jangka waktu lima tahun, kecuali: a. pihak yang rahasianya diungkap memberikan persetujuan tertulis, dan/atau; b. pengungkapan berkaitan dengan posisi seseorang dalam jabatan-jabatan publik,"" tulis Affifudin dalam keputusan itu. SCROLL TO CONTINUE WITH CONTENT Dalam keputusan itu, tertuang 16 dokumen yang tidak bisa dibuka ke publik berkaitan dengan syarat menjadi capres-cawapres. Salah satu dokumen yang tidak bisa dibuka tanpa persetujuan yakni perihal dokumen ijazah. Berikut ini 16 dokumen syarat pendaftaran capres dan cawapres yang tidak bisa dibuka ke publik tanpa persetujuan: 1. Fotokopi kartu tanda penduduk elektronik dan foto akta kelahiran warga negara Indonesia 2. Surat keterangan catatan kepolisian dari Markas Besar Kepolisian Negara Republik Indonesia 3. Surat keterangan kesehatan dari rumah sakit pemerintah yang ditunjuk oleh Komisi Pemilihan Umum 4. Surat tanda terima atau bukti penyampaian laporan harta kekayaan pribadi kepada Komisi Pemberantasan Korupsi 5. Surat keterangan tidak sedang dalam keadaan pailit dan/atau tidak memiliki tanggungan utang yang dikeluarkan oleh pengadilan negeri 6. Surat pernyataan tidak sedang dicalonkan sebagai anggota Dewan Perwakilan Rakyat, Dewan Perwakilan Daerah, dan Dewan Perwakilan Rakyat Daerah 7. Fotokopi nomor pokok wajib pajak dan tanda bukti pengiriman atau penerimaan Surat Pemberitahuan Tahunan Pajak Penghasilan Wajib Pajak Orang Pribadi selama 5 (lima) tahun terakhir 8. Daftar riwayat hidup, profil singkat, dan rekam jejak setiap bakal calon 9. Surat pernyataan belum pernah menjabat sebagai Presiden atau Wakil Presiden selama 2 (dua) kali masa jabatan dalam jabatan yang sama 10. Surat pernyataan setia kepada Pancasila sebagai dasar negara, Undang-Undang Dasar Negara Republik Indonesia Tahun 1945, dan cita-cita Proklamasi 17 Agustus 1945 sebagaimana yang dimaksud dalam Pembukaan Undang-Undang Dasar Negara Republik Indonesia Tahun 1945 11. Surat keterangan dari pengadilan negeri yang menyatakan bahwa setiap bakal calon tidak pernah dipidana penjara berdasarkan putusan pengadilan yang telah memperoleh kekuatan hukum tetap karena melakukan tindak pidana yang diancam dengan pidana penjara 5 (lima) tahun atau lebih 12. Bukti kelulusan berupa fotokopi ijazah, surat tanda tamat belajar, atau surat keterangan lain yang dilegalisasi oleh satuan pendidikan atau program pendidikan menengah 13. Surat keterangan tidak terlibat organisasi terlarang dan G.30.S/PKI dari kepolisian 14. Surat pernyataan bermeterai cukup tentang kesediaan yang bersangkutan diusulkan sebagai bakal calon Presiden dan bakal calon Wakil Presiden secara berpasangan 15. Surat pernyataan pengunduran diri sebagai anggota Tentara Nasional Indonesia, Kepolisian Negara Republik Indonesia, dan Pegawai Negeri Sipil sejak ditetapkan sebagai Pasangan Calon Peserta Pemilu 16. Surat pernyataan pengunduran diri dari karyawan atau pejabat badan usaha milik negara atau badan usaha milik daerah sejak ditetapkan sebagai Pasangan Calon Peserta Pemilu.  Saksikan Live DetikSore : Simak juga Video Roy Suryo soal UGM Pastikan Keaslian Ijazah Jokowi: Abal-abal  [Gambas:Video 20detik]";6
BNN Bekuk 53 Tersangka dari 11 Jaringan Pengedar, 503 Kg Narkoba Disita;;Senin, 15 Sep 2025 11:53 WIB;Jabbar Ramdhani - detikNews;https://news.detik.com/berita/d-8112445/bnn-bekuk-53-tersangka-dari-11-jaringan-pengedar-503-kg-narkoba-disita;https://akcdn.detik.net.id/community/media/visual/2025/09/15/bnn-membongkar-11-jaringan-pengedar-narkoba-di-sejumlah-wilayah-puluhan-orang-tersangka-ditangkap-bnn-dok-ig-infobnnri-1757912014372_43.jpeg?w=210&q=90;"Badan Narkotika Nasional (BNN) membongkar 11 jaringan pengedar narkoba di sejumlah wilayah. Puluhan orang tersangka ditangkap BNN. ""BNN pusat dan provinsi bersinergi dengan stakeholder terkait, berhasil melumpuhkan 11 jaringan narkotika di berbagai daerah strategis dengan 53 tersangka,"" kata Kepala BNN RI Komjen Suyudi Ario Seto dalam jumpa pers di kantor BNN, Jakarta, Senin (15/9/2025). Dia mengatakan pengungkapan kasus dilakukan pada periode Agustus-September. Total barang bukti yang diamankan 503.715,65 gram (503 kg) narkoba atau 0,5 ton lebih. Narkoba yang disita terdiri dari: - sabu 60.226,71 gram- sabu cair 352 ml- ganja 441.376,17 gram - ekstasi 2.134 butir atau 791,77 gram- kokain seberat 1.321 gran- ganja sintetik 80 mm- bahan kimia padat 4.674,37 gram- bahan kimia ciar 5.483 gram SCROLL TO CONTINUE WITH CONTENT  BNN juga membongkar klandestin laboratorium sabu dengan skala home industry kemudian mengamankan vape mengandung narkotika dan obat berbahaya. Dalam kesempatan ini, BNN juga memusnahkan barang bukti yang sudah mendapatkan penetapan dari kejaksaan. ""Kasus-kasus itu berasal dari perkara BNN yaitu BNNP Sumsel, Kepri, Riau, Lampung, Jawa Barat, Jawa Timur, Bali, Kalimantan Tengah, Kalimantan Utara, dan Sulsel,"" rincinya. Barang bukti barkoba yang dimusnahkan terdiri dari sabu 109.896,98 gram, ganja 326.553,88 gram, ekstasi 2.086 butir, kokain 1.310,40 gram, serta bahan kimia prekursor 4.638 gram dan 5.573 ml.   Suyudi mengatakan BNN juga mengungkap kasus tindak pidana pencucian uang (TPPU) yang terjadi di Sumatera Selatan (Sumsel). Nilai TPPU dalam kasus tersebut lebih dari Rp 52 miliar. ""BNN mengungkap hasil TPPU jaringan Sutarnedi dkk di wilayah hukum Palembang Sumsel. Total aset diestimasikan Rp 52.788.500.000,"" katanya. Dia menegaskan narkoba merupakan ancaman nyata yang merongrong generasi muda bangsa. Dia mengatakan pemberantasan narkoba akan terus digencarkan.  ""Tindakan nyata yang dilakukan BNN telah menyelamatkan 1,1 juta jiwa anak bangsa, mencegah ekonomi negara sebesar Rp 130 miliar. Angka ini bukan sekadar barang bukti, melainkan cermin ancaman yang dihadapi bangsa ini,"" katanya.  Simak juga Video: Peredaran Sabu 80 Kg dan 40 Ribu Pil Ekstasi di Surabaya Digagalkan  [Gambas:Video 20detik]  ";6
Hari Keselamatan Pasien Sedunia 2025: Tema dan Cara Merayakan;;Senin, 15 Sep 2025 11:53 WIB;Widhia Arum Wibawana - detikNews;https://news.detik.com/berita/d-8112772/hari-keselamatan-pasien-sedunia-2025-tema-dan-cara-merayakan;https://akcdn.detik.net.id/community/media/visual/2024/09/20/ilustrasi-pasien-1_43.jpeg?w=210&q=90;"Setiap tanggal 17 September diperingati sebagai Hari Keselamatan Pasien Sedunia atau World Patient Safety Day. Tahun ini, peringatan difokuskan pada upaya memastikan perawatan yang aman bagi bayi baru lahir dan anak-anak, kelompok yang paling rentan terhadap risiko kesehatan. Organisasi Kesehatan Dunia (WHO) menegaskan, satu insiden keselamatan dapat berdampak seumur hidup terhadap kesehatan dan perkembangan anak. Karena itu, Hari Keselamatan Pasien Sedunia 2025 mengajak semua pihak untuk meningkatkan kepedulian terhadap keselamatan anak sejak awal kehidupan. Tema yang diangkat WHO pada 2025 adalah ""Safe care for every newborn and every child"" atau ""Perawatan aman bagi setiap bayi baru lahir dan setiap anak"". Slogannya, ""Patient safety from the start!"", menekankan pentingnya mencegah risiko sejak anak dilahirkan hingga usia 9 tahun. SCROLL TO CONTINUE WITH CONTENT WHO menjelaskan, anak-anak memiliki kebutuhan kesehatan yang berbeda dengan orang dewasa. Pertumbuhan yang cepat, pola penyakit yang khas, hingga faktor sosial-ekonomi dapat membuat mereka lebih rentan mengalami cedera atau dampak jangka panjang jika tidak mendapat perawatan yang sesuai. Dengan memastikan keselamatan sejak dini, manfaatnya bisa dirasakan sepanjang kehidupan dan mendukung pencapaian Tujuan Pembangunan Berkelanjutan (SDGs), khususnya target kesehatan yang adil dan berkualitas. Dalam peringatan tahun ini, WHO menetapkan sejumlah tujuan untuk mendorong perubahan nyata di tingkat pelayanan kesehatan. Tujuan tersebut menekankan area prioritas yang perlu diperbaiki agar risiko bahaya yang dapat dihindari bisa diminimalkan. WHO juga menyerukan kolaborasi berbagai pihak, mulai dari orang tua, pengasuh, tenaga kesehatan, pimpinan rumah sakit, pendidik, hingga komunitas. Sinergi ini dinilai penting untuk menciptakan sistem perawatan anak yang lebih aman, berkualitas, dan berkelanjutan. WHO mendorong peringatan Hari Keselamatan Pasien Sedunia dilakukan dengan berbagai aksi nyata, di antaranya: Hari Keselamatan Pasien Sedunia 2025 menjadi momentum global untuk memperkuat komitmen terhadap perlindungan anak. Dengan tema ""Safe care for every newborn and every child"", WHO mengajak semua pihak bekerja sama mewujudkan layanan kesehatan yang aman dan adil bagi generasi masa depan.";6
Komdigi Bilang Video Prabowo di Bioskop Wajar, Ungkit Tanggung Jawab Ini;;Senin, 15 Sep 2025 11:52 WIB;Antara News - detikNews;https://news.detik.com/berita/d-8112444/komdigi-bilang-video-prabowo-di-bioskop-wajar-ungkit-tanggung-jawab-ini;https://akcdn.detik.net.id/community/media/visual/2025/01/21/direktur-jenderal-komunikasi-publik-dan-media-dirjen-kpm-kemkomdigi-fifi-aleyda-yahya_43.jpeg?w=210&q=90;"Kementerian Komunikasi dan Digital menyatakan, penyiaran rekaman video mengenai kinerja pemerintahan Presiden Prabowo Subianto di bioskop merupakan bagian komunikasi publik. Pemerintah memanfaatkan berbagai media komunikasi, termasuk bioskop, untuk menyampaikan informasi resmi kepada masyarakat. ""Komunikasi publik pada era digital tidak lagi terbatas pada satu kanal,"" kata Direktur Jenderal Komunikasi Publik dan Media Kementerian Komunikasi dan Digital, Fifi Aleyda Yahya, dilansir Antara, Senin (15/9/2025).  SCROLL TO CONTINUE WITH CONTENT Pemerintah, menurutnya, memiliki tanggung jawab untuk memastikan informasi sampai ke publik. Soal mengapa lewat bioskop, menurutnya itu bukan pelanggaran. ""Pemerintah memiliki tanggung jawab untuk memastikan informasi yang penting dapat tersampaikan kepada publik secara luas, efektif, dan sesuai dengan perkembangan zaman sepanjang tidak melanggar aturan bioskop medium yang sah dan wajar untuk dipilih,"" ujarnya. Fifi mengatakan, bioskop hanya salah satu dari sekian banyak saluran yang dimanfaatkan oleh pemerintah untuk mengomunikasikan informasi perihal pelaksanaan program dan kebijakan kepada publik. Fifi mengatakan pemerintah memilih bioskop sebagai salah satu sarana untuk menyampaikan informasi kepada publik karena bisa menghadirkan pengalaman visual dan audio yang lebih baik, yang diharapkan bisa membuat masyarakat lebih mudah menerima informasi secara utuh. ""Konteksnya adalah bagaimana negara hadir dengan informasi yang benar dan terukur. Jadi, ini bagian dari komunikasi publik pemerintah kepada masyarakat,"" katanya.  Diketahui, pemutaran video yang menampilkan Presiden Prabowo menjelaskan capaian pemerintah sebelum penayangan film di bioskop menjadi perbincangan warga di platform media sosial. Tayangan video itu mencakup informasi tentang produksi beras nasional yang telah mencapai 21,76 juta ton hingga Agustus 2025 serta peluncuran 80.000 Koperasi Desa Merah Putih dan 100 Sekolah Rakyat. Selain itu, disampaikan pula kemajuan pelaksanaan program Makan Bergizi Gratis (MBG), yang sejak diluncurkan pada 6 Januari 2025 telah menjangkau 20 juta penerima manfaat.  Simak Video Prabowo di Bioskop Agar Rakyat Tahu yang Dikerjakan Pemerintah  [Gambas:Video 20detik]  ";6
Netanyahu Bicara Soal Perlunya Menyingkirkan Hamas di Qatar;;Senin, 15 Sep 2025 11:43 WIB;Novi Christiastuti - detikNews;https://news.detik.com/internasional/d-8112427/netanyahu-bicara-soal-perlunya-menyingkirkan-hamas-di-qatar;https://akcdn.detik.net.id/community/media/visual/2024/07/25/momen-netanyahu-pidato-di-kongres-as-8_43.jpeg?w=210&q=90;"Perdana Menteri (PM) Israel Benjamin Netanyahu mengatakan bahwa menyingkirkan para pemimpin Hamas yang tinggal di Qatar akan menghilangkan hambatan utama untuk membebaskan semua sandera dan mengakhiri perang di Jalur Gaza. Pernyataan ini, seperti dilansir Reuters dan Al Arabiya, Senin (15/9/2025), disampaikan Netanyahu setelah militer Israel pekan lalu melancarkan serangan mengejutkan di Doha, ibu kota Qatar, yang diklaim menargetkan para pemimpin senior Hamas yang tinggal di sana. Serangan itu menuai kecaman banyak pihak, terutama Qatar, yang selama ini menjadi salah satu tempat untuk perundingan gencatan senjata Gaza. Amerika Serikat (AS), sekutu dekat Israel, juga menegur Tel Aviv atas serangannya tersebut, meski pun Washington telah mendapatkan pemberitahuan sebelumnya. SCROLL TO CONTINUE WITH CONTENT ""Para pemimpin teroris Hamas yang tinggal di Qatar tidak peduli dengan rakyat Gaza,"" kata Netanyahu dalam pernyataan terbarunya via media sosial X.  ""Mereka memblokir semua upaya gencatan senjata untuk memperpanjang perang tanpa henti,"" sebutnya. ""Menyingkirkan mereka akan menghilangkan hambatan utama untuk membebaskan semua sandera kita dan mengakhiri perang,"" tegas Netanyahu dalam pernyataannya. Kelompok Hamas, yang menguasai Jalur Gaza, mengatakan lima anggotanya, termasuk putra pemimpin Hamas Khalil al-Hayya, yang jadi negosiator utama kelompok itu, tewas dalam serangan Tel Aviv di Doha. Namun para pemimpin senior dan anggota tim negosiasi Al-Hayya diklaim berhasil selamat.  Otoritas Qatar menyebut seorang anggota pasukan keamanan internalnya juga tewas dalam serangan pada Selasa (9/9) pekan lalu. Hamas menggambarkan serangan di Doha sebagai upaya Israel untuk menggagalkan negosiasi gencatan senjata Gaza. Kelompok yang didukung Iran itu menegaskan tidak akan mengubah persyaratan kelompok tersebut untuk mengakhiri perang di Jalur Gaza. Israel menuntut Hamas untuk membebaskan semua sandera yang masih ditahan di Jalur Gaza dan melucuti semua persenjataannya. Namun, Hamas menegaskan tidak akan membebaskan semua sandera tanpa adanya kesepakatan yang akan mengakhiri perang Gaza secara permanen. Hamas juga menolak untuk menyerahkan senjata sampai Palestina menjadi negara yang merdeka.  Simak juga Video Netanyahu Tuding Qatar Lindungi Hamas: Usir Mereka Sekarang!  [Gambas:Video 20detik]  ";6
